{
  "$schema": "https://json-schema.org/draft/2020-12/schema",
  "$id": "https://sandra.local/schemas/managed-object.schema.json",
  "title": "ManagedObject",
  "type": "object",
  "additionalProperties": false,
  "required": [
    "apiVersion",
    "kind",
    "metadata",
    "spec",
    "status"
  ],
  "properties": {
    "apiVersion": {
      "const": "governance.sandra.io/v1"
    },
    "kind": {
      "const": "ManagedObject"
    },
    "metadata": {
      "type": "object",
      "additionalProperties": false,
      "required": [
        "id",
        "name",
        "labels",
        "annotations",
        "createdAt",
        "updatedAt"
      ],
      "properties": {
        "id": {
          "type": "string",
          "pattern": "^obj_[a-z0-9]{16,64}$"
        },
        "name": {
          "type": "string",
          "minLength": 1
        },
        "labels": {
          "type": "object",
          "additionalProperties": {
            "type": "string"
          }
        },
        "annotations": {
          "type": "object",
          "additionalProperties": {
            "type": "string"
          }
        },
        "createdAt": {
          "type": "string",
          "format": "date-time"
        },
        "updatedAt": {
          "type": "string",
          "format": "date-time"
        }
      }
    },
    "spec": {
      "type": "object",
      "additionalProperties": false,
      "required": [
        "classifications",
        "roles",
        "protectionProfile",
        "declaredIdentifiers",
        "requiredCapabilities",
        "policyBindings"
      ],
      "properties": {
        "classifications": {
          "type": "array",
          "items": {
            "type": "string",
            "minLength": 1
          },
          "uniqueItems": true
        },
        "roles": {
          "type": "array",
          "items": {
            "type": "string",
            "minLength": 1
          },
          "uniqueItems": true
        },
        "protectionProfile": {
          "enum": [
            "protected",
            "critical",
            "standard",
            "disposable"
          ]
        },
        "declaredIdentifiers": {
          "type": "array",
          "items": {
            "type": "object",
            "additionalProperties": false,
            "required": [
              "scheme",
              "value",
              "authority"
            ],
            "properties": {
              "scheme": {
                "type": "string",
                "minLength": 1
              },
              "value": {
                "type": "string",
                "minLength": 1
              },
              "authority": {
                "enum": [
                  "declared",
                  "authoritative",
                  "candidate"
                ]
              }
            }
          }
        },
        "requiredCapabilities": {
          "type": "array",
          "items": {
            "type": "string",
            "pattern": "^[a-z][a-z0-9]*(\\.[a-z][a-z0-9_]*)+$"
          },
          "uniqueItems": true
        },
        "policyBindings": {
          "type": "array",
          "items": {
            "type": "string",
            "minLength": 1
          },
          "uniqueItems": true
        }
      }
    },
    "status": {
      "type": "object",
      "additionalProperties": false,
      "required": [
        "phase",
        "technology",
        "availableCapabilities",
        "conditions",
        "latestObservationAt",
        "reconciliationRevision"
      ],
      "properties": {
        "phase": {
          "enum": [
            "unknown",
            "candidate",
            "active",
            "degraded",
            "conflicting",
            "unsupported",
            "retired"
          ]
        },
        "technology": {
          "type": "object",
          "additionalProperties": false,
          "required": [
            "id",
            "status",
            "evidenceIds"
          ],
          "properties": {
            "id": {
              "type": [
                "string",
                "null"
              ]
            },
            "status": {
              "enum": [
                "unknown",
                "candidate",
                "confirmed",
                "conflicting",
                "unsupported"
              ]
            },
            "evidenceIds": {
              "type": "array",
              "items": {
                "type": "string"
              },
              "uniqueItems": true
            }
          }
        },
        "availableCapabilities": {
          "type": "array",
          "items": {
            "type": "string"
          },
          "uniqueItems": true
        },
        "conditions": {
          "type": "array",
          "items": {
            "type": "object",
            "additionalProperties": false,
            "required": [
              "type",
              "status",
              "reason",
              "observedAt"
            ],
            "properties": {
              "type": {
                "type": "string"
              },
              "status": {
                "enum": [
                  "true",
                  "false",
                  "unknown"
                ]
              },
              "reason": {
                "type": "string"
              },
              "observedAt": {
                "type": "string",
                "format": "date-time"
              }
            }
          }
        },
        "latestObservationAt": {
          "type": [
            "string",
            "null"
          ],
          "format": "date-time"
        },
        "reconciliationRevision": {
          "type": "integer",
          "minimum": 0
        }
      }
    }
  }
}
